title,main_category,categories,average_rating,rating_number,price,debiased_description
"Binoculars for 10x22 Compact Mini Pocket High Powered Binoculars, Waterproof Small Binoculars for Bird Watching, Hunting, Traveling, Sightseeing, Concert.Blue",Camera & Photo,['Electronics' 'Camera & Photo' 'Binoculars & Scopes' 'Binoculars'],5.0,226.0,29.98,"The ICFPWR compact binoculars have a 10x magnification with a 22 mm objective lens. They use BAK4 Porro prisms with multilayer-coated lenses to support image clarity. The stated field of view is 131 m at 1000 m. The binoculars have an 18 mm eyepiece diameter and a 6.2 mm exit pupil, based on the listed specifications.

The binoculars weigh approximately 180 g (0.4 lb) and are designed in a compact, pocket-size format. The body is rubber coated, which provides grip and a degree of impact protection during handling. A central focus wheel allows for manual focus adjustment, intended to be operated with one finger. The exterior uses a soft, non-toxic rubber material for extended handling comfort."
20x50 Binoculars for Adults - High Power Waterproof Binoculars Telescope with Clear Low Light Vision - for Hunting Bird Watching Travel Football Games with Carrying Case and Strap,Camera & Photo,['Electronics' 'Camera & Photo' 'Binoculars & Scopes' 'Binoculars'],4.8,2233.0,29.98,"These binoculars feature 20× magnification with a 50 mm objective lens and a stated field of view of 367 ft at 1000 yds. The optical system includes BAK-4 prisms and fully multi-coated lenses, designed to transmit light for image clarity. The 50 mm lenses allow more light to enter the optics, which supports visibility in low-light conditions, though they do not provide visibility in complete darkness.

The housing is sealed with O-rings and filled with nitrogen to reduce internal fogging and limit water and dust ingress. An exterior rubberized coating provides grip and basic impact protection. The binoculars include a center focus knob and adjustable twist-up eyecups to accommodate users with or without eyeglasses. They are compatible with a phone bracket for image capture. The package includes the binoculars and eyepiece and objective lens caps."
"20x50 High Powered Binoculars for Adults, Premium Waterproof Compact Binoculars with Low Light Vision for Bird Watching Hunting Travel Football Games Stargazing with Carrying Bag",Camera & Photo,['Electronics' 'Camera & Photo' 'Binoculars & Scopes' 'Binoculars'],4.9,65.0,39.99,"These binoculars feature a 20x magnification with a 50 mm objective lens and provide a field of view of 168 yards at 1000 yards. The 26 mm eyepiece size is designed to support extended viewing by offering a wider visual field and maintaining image stability during use. The binoculars are intended for activities that involve observing distant subjects, such as bird watching, outdoor recreation, sporting events, and stargazing.

The optical system includes multilayer-coated aspherical lenses and BAK4 Porro prisms to support light transmission and reduce distortion. A green FMC anti-reflective coating is applied to the objective lenses to minimize reflected light and support image brightness and clarity under varying lighting conditions.

The binoculars use a central focus wheel for image adjustment, allowing focus changes with one hand. The focus wheel has a rubberized surface to improve grip during repeated use. The housing is rubber-coated for impact resistance and handling stability, and it is rated as waterproof for general outdoor use, excluding full immersion. A carrying case and strap are included for transport and storage."
"20x50 High Powered Binoculars for Adults, Premium Waterproof Compact Binoculars with Low Light Vision for Bird Watching Hunting Football Games Travel Stargazing with Carrying Bag",Camera & Photo,['Electronics' 'Camera & Photo' 'Binoculars & Scopes' 'Binoculars'],4.8,120.0,28.49,"These binoculars feature a 20× magnification with a field of view measuring 168 yards at 1000 yards. They use 26 mm eyepieces and an optical system built with multilayer-coated aspherical lenses and BAK4 Porro prisms. The lenses include a fully multi-coated green anti-reflective layer designed to reduce glare and support light transmission, color accuracy, and image clarity across a range of lighting conditions.

Focusing is controlled through a central focus wheel that allows adjustment with one hand. The wheel has a rubberized, non-slip surface intended to support repeated use over extended viewing periods. The binoculars are designed to align with standard adult eye spacing and can be adjusted to reduce double images during setup.

The body is coated with rubber to provide impact resistance and grip. It is designed to be water-resistant for general outdoor use but not for full immersion. The exterior includes textured, contoured surfaces intended to improve handling stability during activities such as outdoor observation, travel, or event viewing."
Vortex Optics Triumph HD 10x42 Binoculars,Camera & Photo,['Electronics' 'Camera & Photo' 'Binoculars & Scopes' 'Binoculars'],4.7,54.0,99.0,"This full-size binocular features 10x magnification with 42 mm objective lenses and an HD optical system. Fully multi-coated lenses and optimized glass elements are designed to support resolution, reduce chromatic aberration, and maintain consistent color accuracy and sharpness across the field of view. The binocular is suitable for general outdoor observation tasks such as hiking or hunting.

The housing is nitrogen purged and sealed to provide waterproof and fogproof performance. A polycarbonate chassis with full rubber armor offers impact resistance and improved handling. The binocular is tripod adaptable and includes adjustable rubber eyecups and a diopter to accommodate different viewing preferences. Included accessories consist of a neck strap and an adjustable GlassPak harness for carrying and access."
occer Binoculars for Adults High Powered 10x42 - Real Waterproof Binoculars with Crystal Clear View - Binocular with Long Range for Bird Watching Cruise Travel Boating Hunting Hiking,Camera & Photo,['Electronics' 'Camera & Photo' 'Binoculars & Scopes' 'Binoculars'],4.8,13.0,89.99,"These binoculars are designed with a nitrogen-filled, O-ring–sealed housing that provides waterproof and fog-resistant performance. The sealed construction is intended for use in outdoor environments and varying weather conditions. The body is built for repeated handling during activities such as hiking, boating, or wildlife observation.

The optical system includes BaK4 prisms, fully multi-coated lenses, and a 42 mm objective lens. This configuration supports light transmission and image clarity across standard daylight conditions and low-light environments. The binoculars feature a central focus wheel and a diopter adjustment ring to accommodate differences between the user’s eyes, along with adjustable eyecups that can be extended or retracted depending on whether glasses are worn.

The binoculars have a 42 mm objective lens diameter and a 20 mm eyepiece diameter. The package includes the binoculars, a carrying bag with a shoulder strap, a glass cleaning cloth, and user instructions, making the set suitable for transport and routine maintenance."
Nikon 8252 ACULON 10-22 x 50 Zoom Binoculars (A211) Bundle with Deco Gear FPT100BK Tactical Flashlight and Tactical Pen Set with Water/Shockproof Case + Deco Microfiber Cleaning Cloth,Camera & Photo,['Electronics' 'Camera & Photo' 'Binoculars & Scopes' 'Binoculars'],4.8,6.0,196.95,"The Nikon ACULON A211 10–22x50 zoom binoculars provide variable magnification from 10x to 22x and use 50 mm objective lenses. The optics include multicoated lenses and BaK4 Porro prisms, designed to support image clarity across different lighting conditions. The lenses are made with Nikon Eco-Glass, which is free of lead and arsenic. A central focus knob allows for manual focus adjustment.

The binoculars feature a rubber-armored exterior intended to improve grip and provide basic impact protection. The body is designed to be relatively lightweight for handheld use. This product is a Nikon USA authorized item and includes a full Nikon USA warranty.

The package includes the Nikon ACULON A211 10–22x50 binoculars, a Deco Gear FPT100BK tactical flashlight and tactical pen set with a water- and shock-resistant case, and a 6 x 6 inch microfiber cleaning cloth."
Kowa Sporting Optics 6x30mm YF Porro Prism Binoculars with Kowa Lens Pen Bundle (2 Items),Camera & Photo,['Electronics' 'Camera & Photo' 'Binoculars & Scopes' 'Binoculars'],5.0,3.0,109.99,"This bundle includes the Kowa Sporting Optics 6x30mm YF Porro Prism Binoculars in black and a Kowa Anniversary Edition Lens Pen. The binoculars use a Porro prism optical design with 6x magnification and 30mm objective lenses, providing a wide field of view measuring approximately 140 feet at 1000 yards. The optical system is manufactured from Japanese eco-glass, and all lens surfaces are fully multicoated to support consistent light transmission and color accuracy.
The binoculars offer 20mm of eye relief and a minimum focusing distance of 5 meters, making them suitable for users who wear glasses and for viewing subjects at relatively close range. The housing is designed to be waterproof, supporting use in varied outdoor conditions. The included lens pen is intended for routine cleaning and maintenance of optical surfaces."
Kowa Sporting Optics 8x30mm YF Porro Prism Binoculars Bundle with Kowa Lens Pen (2 Items),Camera & Photo,['Electronics' 'Camera & Photo' 'Binoculars & Scopes' 'Binoculars'],5.0,3.0,119.99,"This bundle includes Kowa Sporting Optics 8x30mm YF Porro Prism binoculars in black and a Kowa Anniversary Edition lens pen. The binoculars use a Porro prism optical design with 8x magnification and 30mm objective lenses, resulting in a wide field of view. Optical components are made from Japanese eco-glass, and all lens surfaces are fully multicoated to support light transmission, color accuracy, and image contrast.

The binocular housing is designed to accommodate the Porro prism configuration, which places the objective lenses farther apart than roof prism designs. The binoculars are waterproof and intended for outdoor observation. The optical system is designed to provide clear and representative images under typical viewing conditions.

The included lens pen is a manual lens cleaning tool with a retractable brush for removing dust and debris and a round polishing tip for cleaning smudges and fingerprints. It is designed for use on multicoated optical surfaces, including binoculars, cameras, telescopes, and similar equipment."
"Nikon 16768 Monarch M5 10x42 Binocular with Lens Pen, Harness, & Flashlight Kit",Camera & Photo,['Electronics' 'Camera & Photo' 'Binoculars & Scopes' 'Binoculars'],5.0,3.0,296.95,"The Nikon Monarch M5 10x42 binocular features a rubber-armored exterior designed to provide shock resistance and a stable grip during use. It uses a roof prism system with phase-corrected coatings applied to the prism surfaces to support image resolution and clarity. The binocular is nitrogen-filled and O-ring sealed, making it waterproof and resistant to internal fogging in varying weather conditions.

This model offers 10x magnification with a 42 mm objective lens and a wide field of view, allowing observation of a broader scene and easier subject acquisition. ED (extra-low dispersion) glass is used to help reduce chromatic aberration, and dielectric multilayer prism coatings support light transmission. The binocular includes a central focusing system, adjustable eyecups, and eye relief suitable for use with or without eyeglasses.

The bundle includes standard supplied accessories: a neck strap, carrying case, one-piece ocular rainguard, two objective lens caps, and a Nikon Lifetime Limited Warranty. Additional included items are a Nikon Lens Pen cleaning system, a binocular harness strap, and a Waith flashlight."
"Nikon PROSTAFF P3 8x42 Waterproof Binocular for Adults | Small & Compact Travel Binoculars for Bird Watching | Lens Pen Cleaning System, & Flashlight Bundle Set",Camera & Photo,['Electronics' 'Camera & Photo' 'Binoculars & Scopes' 'Binoculars'],5.0,3.0,124.73,
Nikon 8246 ACULON 10x42 Binoculars (A211) Bundle with Deco Gear FPT100BK Tactical Flashlight and Tactical Pen Set with Water/Shockproof Case + Deco Microfiber Cleaning Cloth,Camera & Photo,['Electronics' 'Camera & Photo' 'Binoculars & Scopes' 'Binoculars'],5.0,2.0,111.84,
Nikon 7277 8x25 Travelite Binoculars Bundle with Deco Gear Tactical Flashlight and Tactical Pen Set with Water/Shockproof Case and 6 x 6 inch Microfiber Cleaning Cloth,Camera & Photo,['Electronics' 'Camera & Photo' 'Binoculars & Scopes' 'Binoculars'],5.0,1.0,106.95,
"12x42 HD Binoculars, BAK4 Prism HD Professional Binoculars for Bird Watching, Hunting, Light Weight",Camera & Photo,['Electronics' 'Camera & Photo' 'Binoculars & Scopes' 'Binoculars'],5.0,1.0,17.0,
"Professional HD 8x42 Binoculars for Adults, IP7X Waterproof BAK4 Prisms FMC Lens, Super Bright Large View 22MM Eyepiece, Binoculars with Phone Adapter Tripod, Perfect for Bird Watching, Hunting",Camera & Photo,['Electronics' 'Camera & Photo' 'Binoculars & Scopes' 'Binoculars'],3.7,11.0,48.07,
